[
  {
    "record_id": "00000000-0000-0000-0000-000000000001",
    "subject_did": "did:example:ai-demo",
    "schema_version": "0.1",
    "normalized_at": "2026-09-30T00:00:00Z",
    "source": {
      "provider": "upload",
      "external_id": "synthetic-1",
      "fetched_at": "2026-09-30T00:00:00Z"
    },
    "format": "VC2.0",
    "issuer": {
      "did": "did:example:demo-issuer",
      "name": "가상 교육기관",
      "trust_level": "known"
    },
    "achievement": {
      "id": "synthetic-1",
      "name": "Python 기초 수료",
      "description": "가상 테스트 자료"
    },
    "evidence": [],
    "skills": [],
    "verification": {
      "status": "verified",
      "checks": [
        {
          "check": "schema",
          "result": "pass",
          "checked_at": "2026-09-30T00:00:00Z",
          "detail": "Synthetic test fixture; not cryptographically verified"
        },
        {
          "check": "did_resolution",
          "result": "pass",
          "checked_at": "2026-09-30T00:00:00Z",
          "detail": "Synthetic test fixture; not cryptographically verified"
        },
        {
          "check": "signature",
          "result": "pass",
          "checked_at": "2026-09-30T00:00:00Z",
          "detail": "Synthetic test fixture; not cryptographically verified"
        },
        {
          "check": "issuer_trust",
          "result": "pass",
          "checked_at": "2026-09-30T00:00:00Z",
          "detail": "Synthetic test fixture; not cryptographically verified"
        },
        {
          "check": "revocation",
          "result": "pass",
          "checked_at": "2026-09-30T00:00:00Z",
          "detail": "Synthetic test fixture; not cryptographically verified"
        },
        {
          "check": "anchor_match",
          "result": "skip",
          "checked_at": "2026-09-30T00:00:00Z",
          "detail": "Synthetic test fixture; not cryptographically verified"
        },
        {
          "check": "expiration",
          "result": "pass",
          "checked_at": "2026-09-30T00:00:00Z",
          "detail": "Synthetic test fixture; not cryptographically verified"
        }
      ],
      "verified_at": "2026-09-30T00:00:00Z",
      "verifier_version": "synthetic-test-only"
    },
    "raw_hash": "8a83d94d44b74afe4f81305048bf6e5b3f5f5ba22a2947652fdcf5b83290fc8c"
  },
  {
    "record_id": "00000000-0000-0000-0000-000000000002",
    "subject_did": "did:example:ai-demo",
    "schema_version": "0.1",
    "normalized_at": "2026-09-30T00:00:00Z",
    "source": {
      "provider": "upload",
      "external_id": "synthetic-2",
      "fetched_at": "2026-09-30T00:00:00Z"
    },
    "format": "VC2.0",
    "issuer": {
      "did": "did:example:demo-issuer",
      "name": "가상 교육기관",
      "trust_level": "known"
    },
    "achievement": {
      "id": "synthetic-2",
      "name": "Python 전문가 자격",
      "description": "가상 테스트 자료"
    },
    "evidence": [],
    "skills": [],
    "verification": {
      "status": "invalid",
      "checks": [
        {
          "check": "schema",
          "result": "pass",
          "checked_at": "2026-09-30T00:00:00Z",
          "detail": "Synthetic test fixture; not cryptographically verified"
        },
        {
          "check": "did_resolution",
          "result": "pass",
          "checked_at": "2026-09-30T00:00:00Z",
          "detail": "Synthetic test fixture; not cryptographically verified"
        },
        {
          "check": "signature",
          "result": "fail",
          "checked_at": "2026-09-30T00:00:00Z",
          "detail": "Synthetic test fixture; not cryptographically verified"
        },
        {
          "check": "issuer_trust",
          "result": "pass",
          "checked_at": "2026-09-30T00:00:00Z",
          "detail": "Synthetic test fixture; not cryptographically verified"
        },
        {
          "check": "revocation",
          "result": "pass",
          "checked_at": "2026-09-30T00:00:00Z",
          "detail": "Synthetic test fixture; not cryptographically verified"
        },
        {
          "check": "anchor_match",
          "result": "skip",
          "checked_at": "2026-09-30T00:00:00Z",
          "detail": "Synthetic test fixture; not cryptographically verified"
        },
        {
          "check": "expiration",
          "result": "pass",
          "checked_at": "2026-09-30T00:00:00Z",
          "detail": "Synthetic test fixture; not cryptographically verified"
        }
      ],
      "verified_at": "2026-09-30T00:00:00Z",
      "verifier_version": "synthetic-test-only"
    },
    "raw_hash": "aa2f4fa70b74a4b8851e3247959596141665da2a6bb16b4d52db4fc81653a707"
  },
  {
    "record_id": "00000000-0000-0000-0000-000000000003",
    "subject_did": "did:example:ai-demo",
    "schema_version": "0.1",
    "normalized_at": "2026-09-30T00:00:00Z",
    "source": {
      "provider": "upload",
      "external_id": "synthetic-3",
      "fetched_at": "2026-09-30T00:00:00Z"
    },
    "format": "VC2.0",
    "issuer": {
      "did": "did:example:demo-issuer",
      "name": "가상 교육기관",
      "trust_level": "known"
    },
    "achievement": {
      "id": "synthetic-3",
      "name": "SQL 자격",
      "description": "가상 테스트 자료"
    },
    "evidence": [],
    "skills": [],
    "verification": {
      "status": "revoked",
      "checks": [
        {
          "check": "schema",
          "result": "pass",
          "checked_at": "2026-09-30T00:00:00Z",
          "detail": "Synthetic test fixture; not cryptographically verified"
        },
        {
          "check": "did_resolution",
          "result": "pass",
          "checked_at": "2026-09-30T00:00:00Z",
          "detail": "Synthetic test fixture; not cryptographically verified"
        },
        {
          "check": "signature",
          "result": "pass",
          "checked_at": "2026-09-30T00:00:00Z",
          "detail": "Synthetic test fixture; not cryptographically verified"
        },
        {
          "check": "issuer_trust",
          "result": "pass",
          "checked_at": "2026-09-30T00:00:00Z",
          "detail": "Synthetic test fixture; not cryptographically verified"
        },
        {
          "check": "revocation",
          "result": "fail",
          "checked_at": "2026-09-30T00:00:00Z",
          "detail": "Synthetic test fixture; not cryptographically verified"
        },
        {
          "check": "anchor_match",
          "result": "skip",
          "checked_at": "2026-09-30T00:00:00Z",
          "detail": "Synthetic test fixture; not cryptographically verified"
        },
        {
          "check": "expiration",
          "result": "pass",
          "checked_at": "2026-09-30T00:00:00Z",
          "detail": "Synthetic test fixture; not cryptographically verified"
        }
      ],
      "verified_at": "2026-09-30T00:00:00Z",
      "verifier_version": "synthetic-test-only"
    },
    "raw_hash": "4cfd63eccc4aae3388b8705807a407d510eca5e210da3d342679870a05ed8dd1"
  },
  {
    "record_id": "00000000-0000-0000-0000-000000000004",
    "subject_did": "did:example:ai-demo",
    "schema_version": "0.1",
    "normalized_at": "2026-09-30T00:00:00Z",
    "source": {
      "provider": "upload",
      "external_id": "synthetic-4",
      "fetched_at": "2026-09-30T00:00:00Z"
    },
    "format": "VC2.0",
    "issuer": {
      "did": "did:example:demo-issuer",
      "name": "가상 교육기관",
      "trust_level": "known"
    },
    "achievement": {
      "id": "synthetic-4",
      "name": "영어 인증",
      "description": "가상 테스트 자료"
    },
    "evidence": [],
    "skills": [],
    "verification": {
      "status": "expired",
      "checks": [
        {
          "check": "schema",
          "result": "pass",
          "checked_at": "2026-09-30T00:00:00Z",
          "detail": "Synthetic test fixture; not cryptographically verified"
        },
        {
          "check": "did_resolution",
          "result": "pass",
          "checked_at": "2026-09-30T00:00:00Z",
          "detail": "Synthetic test fixture; not cryptographically verified"
        },
        {
          "check": "signature",
          "result": "pass",
          "checked_at": "2026-09-30T00:00:00Z",
          "detail": "Synthetic test fixture; not cryptographically verified"
        },
        {
          "check": "issuer_trust",
          "result": "pass",
          "checked_at": "2026-09-30T00:00:00Z",
          "detail": "Synthetic test fixture; not cryptographically verified"
        },
        {
          "check": "revocation",
          "result": "pass",
          "checked_at": "2026-09-30T00:00:00Z",
          "detail": "Synthetic test fixture; not cryptographically verified"
        },
        {
          "check": "anchor_match",
          "result": "skip",
          "checked_at": "2026-09-30T00:00:00Z",
          "detail": "Synthetic test fixture; not cryptographically verified"
        },
        {
          "check": "expiration",
          "result": "fail",
          "checked_at": "2026-09-30T00:00:00Z",
          "detail": "Synthetic test fixture; not cryptographically verified"
        }
      ],
      "verified_at": "2026-09-30T00:00:00Z",
      "verifier_version": "synthetic-test-only"
    },
    "raw_hash": "9bc9a4f2ff5e3b2d7f968f44e1ef7e093056a22f363741faad57b73a005378f6"
  },
  {
    "record_id": "00000000-0000-0000-0000-000000000005",
    "subject_did": "did:example:ai-demo",
    "schema_version": "0.1",
    "normalized_at": "2026-09-30T00:00:00Z",
    "source": {
      "provider": "upload",
      "external_id": "synthetic-5",
      "fetched_at": "2026-09-30T00:00:00Z"
    },
    "format": "VC2.0",
    "issuer": {
      "did": "did:example:demo-issuer",
      "name": "가상 교육기관",
      "trust_level": "known"
    },
    "achievement": {
      "id": "synthetic-5",
      "name": "클라우드 인증",
      "description": "가상 테스트 자료"
    },
    "evidence": [],
    "skills": [],
    "verification": {
      "status": "unverifiable",
      "checks": [
        {
          "check": "schema",
          "result": "skip",